{
  "schemaVersion": "2.0.0",
  "packageId": "surah:108",
  "surah": {
    "number": 108,
    "name": "Al-Kawthar",
    "arabicName": "الكوثر",
    "transliteration": "Al-Kawthar",
    "englishLabel": "Abundance",
    "description": "Canonical source layer; custom teaching is not yet authored."
  },
  "contentVersion": "tanzil-1.1",
  "status": "source-only",
  "sourceReferences": [
    {
      "provider": "tanzil",
      "recordKey": "surah:108",
      "version": "1.1",
      "attribution": "Tanzil Project"
    }
  ],
  "ayahs": [
    {
      "id": "ayah:108:1",
      "number": 1,
      "arabic": "إِنَّآ أَعْطَيْنَـٰكَ ٱلْكَوْثَرَ",
      "sourceRawArabic": "بِسْمِ ٱللَّهِ ٱلرَّحْمَـٰنِ ٱلرَّحِيمِ إِنَّآ أَعْطَيْنَـٰكَ ٱلْكَوْثَرَ",
      "words": [
        {
          "id": "word:108:1:1",
          "position": 1,
          "arabic": "إِنَّآ",
          "sourceReferences": [
            {
              "provider": "tanzil",
              "recordKey": "108:1",
              "version": "1.1",
              "attribution": "Tanzil Project"
            }
          ]
        },
        {
          "id": "word:108:1:2",
          "position": 2,
          "arabic": "أَعْطَيْنَـٰكَ",
          "sourceReferences": [
            {
              "provider": "tanzil",
              "recordKey": "108:1",
              "version": "1.1",
              "attribution": "Tanzil Project"
            }
          ]
        },
        {
          "id": "word:108:1:3",
          "position": 3,
          "arabic": "ٱلْكَوْثَرَ",
          "sourceReferences": [
            {
              "provider": "tanzil",
              "recordKey": "108:1",
              "version": "1.1",
              "attribution": "Tanzil Project"
            }
          ]
        }
      ]
    },
    {
      "id": "ayah:108:2",
      "number": 2,
      "arabic": "فَصَلِّ لِرَبِّكَ وَٱنْحَرْ",
      "sourceRawArabic": "فَصَلِّ لِرَبِّكَ وَٱنْحَرْ",
      "words": [
        {
          "id": "word:108:2:1",
          "position": 1,
          "arabic": "فَصَلِّ",
          "sourceReferences": [
            {
              "provider": "tanzil",
              "recordKey": "108:2",
              "version": "1.1",
              "attribution": "Tanzil Project"
            }
          ]
        },
        {
          "id": "word:108:2:2",
          "position": 2,
          "arabic": "لِرَبِّكَ",
          "sourceReferences": [
            {
              "provider": "tanzil",
              "recordKey": "108:2",
              "version": "1.1",
              "attribution": "Tanzil Project"
            }
          ]
        },
        {
          "id": "word:108:2:3",
          "position": 3,
          "arabic": "وَٱنْحَرْ",
          "sourceReferences": [
            {
              "provider": "tanzil",
              "recordKey": "108:2",
              "version": "1.1",
              "attribution": "Tanzil Project"
            }
          ]
        }
      ]
    },
    {
      "id": "ayah:108:3",
      "number": 3,
      "arabic": "إِنَّ شَانِئَكَ هُوَ ٱلْأَبْتَرُ",
      "sourceRawArabic": "إِنَّ شَانِئَكَ هُوَ ٱلْأَبْتَرُ",
      "words": [
        {
          "id": "word:108:3:1",
          "position": 1,
          "arabic": "إِنَّ",
          "sourceReferences": [
            {
              "provider": "tanzil",
              "recordKey": "108:3",
              "version": "1.1",
              "attribution": "Tanzil Project"
            }
          ]
        },
        {
          "id": "word:108:3:2",
          "position": 2,
          "arabic": "شَانِئَكَ",
          "sourceReferences": [
            {
              "provider": "tanzil",
              "recordKey": "108:3",
              "version": "1.1",
              "attribution": "Tanzil Project"
            }
          ]
        },
        {
          "id": "word:108:3:3",
          "position": 3,
          "arabic": "هُوَ",
          "sourceReferences": [
            {
              "provider": "tanzil",
              "recordKey": "108:3",
              "version": "1.1",
              "attribution": "Tanzil Project"
            }
          ]
        },
        {
          "id": "word:108:3:4",
          "position": 4,
          "arabic": "ٱلْأَبْتَرُ",
          "sourceReferences": [
            {
              "provider": "tanzil",
              "recordKey": "108:3",
              "version": "1.1",
              "attribution": "Tanzil Project"
            }
          ]
        }
      ]
    }
  ],
  "teachingEntries": {},
  "volumeReferences": []
}
